{
  "cloneProjects": true,
  "analyzeConflicts": {
    "modes": ["merges", "files", "chunks"],
    "run": true
  },
  "analyzeResults": {
    "modes": ["merges", "files", "chunks"],
    "run": true
  },
  "projectListInfos": [
    {
      "projectList": "./project-lists/projects_name_desc-stars-10.csv",
      "projectDir": "../ba_project-dirs/projects_name_desc-stars-10"
    },
    {
      "projectList": "./project-lists/projects_name_asc-stars-10.csv",
      "projectDir": "../ba_project-dirs//projects_name_asc-stars-10"
    },
    {
      "projectList": "./project-lists/projects_c_desc-stars-100.csv",
      "projectDir": "../ba_project-dirs//projects_c_desc-stars-100"
    },
    {
      "projectList": "./project-lists/projects_go_desc-stars-100.csv",
      "projectDir": "../ba_project-dirs//projects_go_desc-stars-100"
    },
    {
      "projectList": "./project-lists/projects_java_desc-stars-100.csv",
      "projectDir": "../ba_project-dirs/projects_java_desc-stars-100"
    },
    {
      "projectList": "./project-lists/projects_javascript_desc-stars-100.csv",
      "projectDir": "../ba_project-dirs/projects_javascript_desc-stars-100"
    },
    {
      "projectList": "./project-lists/projects_python_desc-stars-100.csv",
      "projectDir": "../ba_project-dirs/projects_python_desc-stars-100"
    },
    {
      "projectList": "./project-lists/projects_typescript_desc-stars-100.csv",
      "projectDir": "../ba_project-dirs/projects_typescript_desc-stars-100"
    }
  ],
  "outDir": "./out"
}